initial_identifier,asin,additional_image_1,additional_image_2,additional_image_3,additional_image_4,additional_image_5,all_categories,brand,category,color,department,description,features,item_dimensions_height,item_dimensions_length,item_dimensions_weight,item_dimensions_width,item_type_keyword,large_image,manufacturer,medium_image,parent_asin,product_group,product_type_name,product_type_subcategory,publisher,size,small_image,subcategory,title,is_eligible_for_prime,reviews_average,sales_rank,error_msg,ASIN,Page ID,ASIN ID,,,,,,Review Header 1,Review Text 1,Review Header 2,Review Text 2,Review Header 3,Review Text 3,Review Header 4,Review Text 4,Review Header 5,Review Text 5
B07GZB5SJZ,B07GZB5SJZ,https://images-na.ssl-images-amazon.com/images/I/41GiMdIhn+L.jpg,https://images-na.ssl-images-amazon.com/images/I/51nCnXcV40L.jpg,https://images-na.ssl-images-amazon.com/images/I/51Ftd3f19ML.jpg,https://images-na.ssl-images-amazon.com/images/I/41SUubos7EL.jpg,https://images-na.ssl-images-amazon.com/images/I/51ZVIE+VOjL.jpg,Home & Kitchen>Bedding>Bed Pillows & Positioners>Reading & Bed Rest Pillows,ComfortSpa,Home & Kitchen,Grey,,"Why struggle with stacks of pillows, trying to find a way to be comfortable while reading in bed or watching TV?Why the ComfortSpa Reading Pillow is superior to similar products:- You will love the firm comfort and convenience of your new lounge backrest! Pillow is stuffed full of shredded foam that offers firm support while conforming to your position.- Bed backrest measures 18? high x 15? wide, and each arm extends a full 11 inches. Use the two bonus arm pockets to secure your book, phone, tablet, or TV remote.- If you?re on bed rest or suffer from GERD or heartburn, our bed chair pillow will provide excellent support so you can rest more comfortably.- We are an eco-friendly company desiring to leave a smaller carbon footprint, so your reading pillow comes compressed for shipping - simply place it in your clothes dryer on a no-heat setting along with two clean tennis balls for about 5 minutes, or, shake and knead vigorously for 5 minutes to separate clumps of shredded foam; pillow will be plump and firm in 24-48 hours. To clean polyester velour cover, simply wipe with damp cloth. We?re so sure you?ll love our lounge pillow, we have a no hassle 100% guarantee refund policy. If you use our ComfortSpa Reading Pillow and do not love it, simply return for a full refund, even used. Add one to your cart today, and consider picking up another as a gift for a friend!","DELUXE READING PILLOW – Experience ultimate comfort with the ComfortSpa shredded foam reading pillow that perfectly adjusts to your position for your personal comfort. Full-sized ARMS with TWO SIDE POCKETS to keep your phone, glasses, book, tablet, or remote accessible and close at hand! | PERFECTLY SIZED BED WEDGE – This ComfortSpa backrest measures a full 18 inches high and 15 inches wide, providing a firm back support pillow . Each arm extends out 11 inches to support your shoulders and neck, reducing shoulder and neck pain. While large enough for an adult , this back rest can be used by the entire family. | VERSATILE COMFORT – Lounge cushion provides comfortable back support for sitting up in bed as you read a good book, while watching TV, or even surfing on your laptop or tablet before falling asleep. If you’re on bedrest or suffer from GERD or heartburn , use as a wedge to elevate your upper body to help you stay more comfortable and sleep better . | EASY CARE – Our ComfortSpa lounge pillow has a beautiful grey velour polyester cover that feels delightful and is easy to spot clean with a damp cloth. The shredded foam padding doesn’t clump; so, it stays soft and comfortable. The attached fabric handle makes it easy to carry your pillow with you from room to room. | GUARANTEE – We’re sure you will love your new reading pillow, and we have a no hassle 100% guarantee refund policy. If you use your ComfortSpa Reading Pillow and do not love it, simply return for a full refund, even used. Add one to your cart today!",1.80E+01,30,6,12,reading-pillows,https://m.media-amazon.com/images/I/41GiMdIhn+L.jpg,Joey's Room,https://m.media-amazon.com/images/I/41GiMdIhn+L._SL160_.jpg,B09HMQFKZD,Kitchen,BODY_POSITIONER,,Joey's Room,,https://m.media-amazon.com/images/I/41GiMdIhn+L._SS125_.jpg,Reading & Bed Rest Pillows,Reading Pillow Bed Wedge Large Adult Backrest Lounge Cushion with Arms and Pockets | Back Support for Sitting Up in Bed / Couch for GERD Heartburn Bedrest by ComfortSpa (Grey),1,4.4,929,,B07GZB5SJZ,19774,50571,,,,,,Blown Away with the Value!,"Wow!!! I am blow away by the value of this pillow. It wasn't pricey at all and yet it is top-notch quality. I put it in the dryer for 5 minutes (air fluff only) and then allowed it to naturally expand for two days on my bed. It really filled out nicely. This pillow is super supportive and comfortable, I love it! I use it to read in bed, but my cats also like snuggling up to it when I'm not using it (it is like a spare lap to them). I am only 5'1"" and thought that this looked too small, but for me it is just right. It is very sturdy and could most certainly support someone larger than me. Also... Confirmed: people don't follow instructions. The product description *clearly* states (as does the paper that comes with this product) that this pillow needs to be fluffed. Ignore the reviewers claiming it is 'unusable' due to being flat. If you don't understand how compression works, you need more support than a pillow can provide.",I Love it!! And so does my dog Ringo!!,My pillow came earlier than it said and we have only had it 2 days and it’s perfect. But now I’m going to have to buy another one because my dog took it from me!,Great support for the back and hips. Will make my gaming and reading sessions more fun!!!,"I am going in for hip surgery in a couple of weeks. I purchased this to aid in sitting up on the couch. Item arrived quickly and well packaged. We fluffed it up as it was nicely vacuumed sealed. This has been great for my back and fits perfectly against the back of the couch. Arm rests a bit low, but this has been a great addition to the house. Also is great to use on the bed.",Perfect for comfort & for post-op surgery needs with support to the back,"My husband bought this reading chair pillow for me and it is amazing!! I recently, as in a little over a week ago, had much needed surgery on my lower back. It's really hard to sit comfortably! This item was delivered in the time period that was expected. However as a Prime Member we expected it in less than the 3 days it took. But, honestly, even waiting 3 days for delivery and then another 24-48 hours for it to ""grow"" (that was fun watching my husband take this out of a small, tight shipping box and then see it's full size without the full expansion was unexpected!!( I'm now sitting comfortably in my pillow reading chair in my bed!! It's giving me GREAT support of the area that was surgically repaired while being very comfortable for the rest!! Stacking pillows for support is something I'll never have the need to do again anytime soon!! I'm considering ordering a couple more for my daughters as they have issues with their backs as well!! I GREATLY recommend this to anyone!! It doesn't matter if you have back issues, other, or not! It's just plain comfy!!!",Pleasantly surprised !!,"Bought this because being propped up using pillows to read in bed wasn't cutting it. Needed something better and this was what I was looking for. Followed the instructions on how to decompress the cushion and literally within minutes the cushion was to the point I could use it comfortably. AND, the side pocket is a perfect place to keep my Amazon Fire Stick. ALSO, didn't hurt that the grey color matched the color scheme my wife is building around. Happy wife !!"
B0733ZCSR9,B0733ZCSR9,https://images-na.ssl-images-amazon.com/images/I/41fAS2JRTkS.jpg,https://images-na.ssl-images-amazon.com/images/I/41dPR9g97JL.jpg,https://images-na.ssl-images-amazon.com/images/I/41rWyE-HSQL.jpg,https://images-na.ssl-images-amazon.com/images/I/41rqpbKWjUL.jpg,https://images-na.ssl-images-amazon.com/images/I/41Cp--EKxNL.jpg,Home & Kitchen>Bedding>Bed Pillows & Positioners>Reading & Bed Rest Pillows,Milliard,Home & Kitchen,Grey,,"Una tarde tranquila con un buen libro es una gran manera de pasar su tiempo, pero encontrar un lugar acogedor para acurrucarse hasta su historia puede ser un reto. Con una almohada de lectura de espuma triturada Milliard, el tiempo de la historia literalmente te dará la bienvenida con los brazos abiertos, ya que este cojín ligero y aireado abrazará tu cuerpo y te apoyará en la posición perfecta para leer.Dame un abrazo. Los reposabrazos están integrados en esta almohada de respaldo envolvente para un abrazo suave y de apoyo que puedes llevar a casi cualquier lugar. En el suelo, en un sofá, en una cama, en un rincón de lectura, en el patio... donde quieras sentarte, relajarte y apoyarte hasta un té de la mañana, una tarde de lectura, o una agradable noche de cine. No hay frijoles sobre él ¿Por qué sentarse en almohadas de puf cuando están rellenas de algo que pertenece a un burrito? Claro, no son judías reales, pero los gránulos de plástico siguen siendo duros, granulados y no cómodos contra tu espalda. En su lugar, nuestra almohada está rellena de espuma viscoelástica de poliuretano de alta densidad, que es famosa por su suavidad de contorno corporal. Comodidad personalizada El relleno de espuma viscoelástica también tiene su propio inserto accesible que se puede rellenar con más espuma para mayor firmeza, o vaciado para aquellos que prefieren sus almohadas blandas. Si tu almohada atrapa un derrame de café o simplemente necesita un poco de frescura, también puedes desabrochar la funda exterior y tirarla en tu lavadora para una limpieza rápida. Ideal para: Lectura vertical en la cama. Se enrolla en el sofá. Jugar videojuegos en el suelo Postura reforzada para la espalda mala. Dormir en posición vertical para la congestión nasal Elevación de brazos y piernas lesionados Todos los productos Milliard están hechos de materiales de la más alta calidad y estamos encantados de hacer que la satisfacción de nuestros consumidores sea nuestra meta #1. Asegúrate de echar un vistazo a nuestros otros productos geniales.","Spill the beans on beanbag cushions and try our soft, luscious foam reading pillows instead. Curl up in bed or on the couch, floor with a good book and relax in our pillow’s arms for comfort and support. | Pillow too firm? Pull some stuffing out. Too soft? Put more stuffing in! The accessible foam insert lets you customize your own comfort and extend your pillow’s service life with fresh foam available from Milliard. Shredded memory foam offers many of the same benefits as its solid alternative, but is lighter, airier, and still molds itself to your comfort. | Zippered velour outer cover has a convenient carry handle for portability, and is easily removable and machine washable for quick cleanup of spills and stains. | Great For: Reading in bed, Curling up on the sofa, Sleeping upright for nasal congestion or acid reflux (heartburn), leg arm and back elevator also works for any sort of bed rest. | All Milliard foam products are vacuum-packed for freshness and should be left to expand for at least 24-48 hours to reach full size. CertiPUR certified. Available in Extra Large, Standard and Petite sizes with replacement covers also available.",1.77E+01,14.96062991,,11.02362204,reading-pillows,https://m.media-amazon.com/images/I/41fAS2JRTkS.jpg,Milliard,https://m.media-amazon.com/images/I/41fAS2JRTkS._SL160_.jpg,,Kitchen,BODY_POSITIONER,,Milliard,Standard 18 Inch,https://m.media-amazon.com/images/I/41fAS2JRTkS._SS125_.jpg,Reading & Bed Rest Pillows,Milliard Reading Pillow Bed Wedge Large Adult Backrest Lounge Cushion with Arms | Back Support for Sitting Up in Bed / Couch for GERD Heartburn Bedrest,1,4.5,2238,,B0733ZCSR9,19774,50572,,,,,,Better than expected,Great support. attached handle makes carrying easy - this pillow is pretty heavy. Can't comment on durability as time will tell (just been using for 4 days). I will buy another one. We use it on our sectional sofa for tv watching (and dozing). Fabric is soft.,"Soft yet firm, Unbelievable comfort",I actually almost cancelled my order for this pillow because of a naysayer. I am so happy I did not. It is incredible. Very firm yet very soft. I use it sitting on floor leaning against couch. I even use it for a pillow for sitting halfway up. I have had 6 surgeries and there are so many ways to use this awesome pillow. It has removable cover as well. I will order another.,DO NOT BUY.,"This should actually be a one-star review, but then you wouldn't have read it. Regardless of the many positive reviews, this bed pillow is overstuffed, hard on the back, and very heavy to move around. Also, the product description makes it seems like child's play to add or remove the shredded foam to Increase or decrease the pillow’s softness. Don’t believe it. It’s a pain to do it ... if you can do it at all. And, If you want to return it, that’s another nightmare, since it’s shipped to the customer highly compressed by machine, in a box that you will never get it back into. Since you must pack this item for return (no, the shipper will not do it free for you) .... you will have to find a very large carton, a lot of packing tape, and possibly a lot of bubble wrap. Then, it may not fit into your vehicle unless it’s an SUV or truck. End of story. Consider ordering a different one.",Helping with recovery!,"I got this for my almost 11 year old daughter as a Christmas gift. She specifically asked for this and loves it. She's got it set up in the corner of her bed and loves to read while snuggled against it, or do homework while it supports her back. But the unexpected use has been for me. On New Years Eve I very suddenly had to deliver a baby 8 weeks early. The emergency surgery resulted in severe trauma and injury to my torso beyond what a c section already entails. I cannot lie flat and am unable to sit up on my own. I asked to borrow this so I could sit on the couch without sinking back into the cushions. It worked for that, so I turned it to the side and am currently lounging comfortably with my feet up. This is so comfy! I don't feel any lumps or weird spots. The fabric is soft, no smells. The arms are just right to prop my elbows up on. So I'm totally going to order another one to keep on the couch because I can see how this will be great even after this painful recovery process is done. I'm impressed!",Every bed needs one!,"I almost didn't try this bc I saw a couple of reviews that criticized the size of the 18 inch version as small, but I am so happy that I took a shot. The size is perfect for me, average height and weight female. I work from home a lot, using a lapdesk and now this, sitting on my bed, and this is so comfy and supportive, as described and for an awesome price considering the amount of memory foam that went into this. The cover is thin, but really soft. I won't mind having to recover it shortly if that's the case. Thank you!"
B0117SNG0O,B0117SNG0O,https://images-na.ssl-images-amazon.com/images/I/41KrQ6ekLbL.jpg,https://images-na.ssl-images-amazon.com/images/I/51XYfPMDnUL.jpg,https://images-na.ssl-images-amazon.com/images/I/51-HjPlzFzL.jpg,https://images-na.ssl-images-amazon.com/images/I/41Gu2hsA0VL.jpg,https://images-na.ssl-images-amazon.com/images/I/313WEwkJd5L.jpg,Home & Kitchen>Bedding>Bed Pillows & Positioners>Reading & Bed Rest Pillows,Linenspa,Home & Kitchen,Stone,,"Prop yourself up and settle in for a good book or favorite movie. The LINENSPA Reading Pillow is filled with shredded foam for just the right amount of moldable comfort and support as you relax.   Use it in bed to properly support your back. This lounge pillow has a plush velour cover, cozy arm rests, and a convenient carry handle on top. Pillow is available in standard and extra-large sizes in neutral navy and stone colors. The extra-large size is also available with a removable neck support option that can be used to enhance comfort around your neck or prop your legs up to increase circulation.  Choose the perfect pillow to customize your support.","Standard size is great for children and teens; Perfect for gaming, reading, relaxing, watching TV, and working on a laptop | Soft and durable velour cover is available in navy and stone colors that work well in any room; Spot clean only | Superior back and shoulder support great for recovery from surgery and other injuries; Convenient fabric carry handle | Arrives compressed and rolled in a box; Shake and fluff, then allow up to 48 hours for full expansion | Cover: 100% Polyester, Fill: 100% Polyurethane Foam",8.00E+00,22,6,8,reading-pillows,https://m.media-amazon.com/images/I/41KrQ6ekLbL.jpg,Linenspa,https://m.media-amazon.com/images/I/41KrQ6ekLbL._SL160_.jpg,B07QMNYF89,Home,BODY_POSITIONER,,Linenspa,Standard,https://m.media-amazon.com/images/I/41KrQ6ekLbL._SS125_.jpg,Reading & Bed Rest Pillows,"Linenspa Shredded Foam Pillow Perfect for Back Support While Relaxing, Gaming, Reading, or Watching TV - Soft Velour Cover, Standard, Stone",1,4.4,1800,,B0117SNG0O,19774,50573,,,,,,What’s all the fuss about??,"So I definitely read reviews before I buy a somewhat pricey item on Amazon. Kind of glad I ignored a lot of the complaints about this one. There were a lot of complaints about having to fluff it up, how it didn’t evenly fluff up and that it had an odd smell. I found none of this to be true. Mine smells perfectly fine and I am including two photos that were taken immediately upon cutting it out of the shrink wrap plastic it came in. I didn’t have to fluff it at all, that’s what it looks like right out of the plastic. So far so comfy. I purchased a roll pillow for under my knees to help with better back support. So far so comfy!",Perfect!,"The media could not be loaded. Anchor it from behind at its bottom with a pillow, and it will be able to stay supported on its own without having to lean it up against the headboard or wall. I didn’t realize just how big the XL would be, haha, but I really enjoy it, and it provides me the perfect amount of softness and firmness. I’ve been experiencing some lower back pain from time to time due to having to stand for long periods of time on occasion, and this pillow has been excellent for alleviating pressure, and it’s just cozy! I absolutely love it. Don’t forget to register yours for their warranty! I’ll be doing the same tonight :)","A+ product, Comfy Yet Sturdy","I bought this based on other amazon reviews. There are cheaper products you can buy at Target etc but this is quality. You get what you paid for. I was skeptical because it comes in a small box and when you unwrap it the foam is compressed and it looks like garbage. However with this said, after you take the time to fluff it up and let the foam expand it is amazing. Don't be fooled! I am actually using it as I write this review. A+ product",Five Stars,Love this reading pillow. Perfect for reading. No more back pains,Pillow for Breastfeeding in bed,"I bought this pillow for nursing my second child while laying/sitting in bed. I learned the first time around how strenuous it can be on your back. If you're looking for a pillow for that reason, stop looking and click ""purchase"", because oh my gosh, this is THE breastfeeding pillow. I'm literally feeding him right now while writing this, my back is well supported and I'm comfortable. I leaned back the other day to close my eyes while nursing and smooshed the filling around to get my head a little more comfortable, and it totally works with you. Love this pillow."
