initial_identifier,asin,additional_image_1,additional_image_2,additional_image_3,additional_image_4,additional_image_5,all_categories,brand,category,color,department,description,features,item_dimensions_height,item_dimensions_length,item_dimensions_weight,item_dimensions_width,item_type_keyword,large_image,manufacturer,medium_image,parent_asin,product_group,product_type_name,product_type_subcategory,publisher,size,small_image,subcategory,title,is_eligible_for_prime,reviews_average,sales_rank,error_msg,ASIN,Page ID,ASIN ID,,,,,,Review Header 1,Review Text 1,Review Header 2,Review Text 2,Review Header 3,Review Text 3,Review Header 4,Review Text 4,Review Header 5,Review Text 5
B072P11H8L,B072P11H8L,https://m.media-amazon.com/images/I/41pajgfUJNL._SL500_.jpg,https://m.media-amazon.com/images/I/41HPoYPKL7L._SL500_.jpg,https://m.media-amazon.com/images/I/51AYP8K-mML._SL500_.jpg,https://m.media-amazon.com/images/I/41xh8Vhx3iL._SL500_.jpg,https://m.media-amazon.com/images/I/41EIQNZS3rL._SL500_.jpg,Electronics>Electronics Features,Amazon Basics,Electronics,Black & Silver,,"Product DescriptionAmazon Basics 2 Slice, Extra-Wide Slot Toaster with 6 Shade Settings, BlackFrom the ManufacturerAmazon Basics",2-slice toaster for toasting one or two slices of bread at a time; 6 shade settings accommodate individual preferences | Extra-wide slots for bagels and thicker slices; each slot measures 5-1/4 inches long by 1-1/4 inches wide | Bagel setting for toasting just the cut side; Frozen setting for defrosting bread; Cancel function ends the session at any time | Extra-lift lever for safely removing smaller pieces; 37-inch power cord (when routed out the back); cord wrap; removable crumb tray (located in the back) | Buttons illuminate to indicate selected settings,7.56E+00,10.7,2.17,6.42,,https://m.media-amazon.com/images/I/51ggMDXxx5L.jpg,Amazon Basics,https://m.media-amazon.com/images/I/51ggMDXxx5L._SL160_.jpg,B07T14YQZP,Kitchen,TOASTER,,Amazon Basics,,https://m.media-amazon.com/images/I/51ggMDXxx5L._SS125_.jpg,Electronics Features,"Amazon Basics 2 Slice, Extra-Wide Slot Toaster with 6 Shade Settings, Black",0,4.5,512,,B072P11H8L,22028,153261,,,,,,Inexpensive and works well.,Excellent toaster. Slots are wide enough and deep enough for my morning bagels at work.,Best toaster I have ever owned,"We absolutely love this toaster. It toasts evenly, very easy to clean, and it has a cancel button as well as a bagel and defrost option. It's a little more expensive than the run of the mill toasters, but well worth the price. Cool feature is the pull out tray on the bottom which makes it stupid easy to clean.",A very reliable and attractive appliance,"I looked at other reviews and waited a year from purchase before I wrote this review. I have had no problems with this toaster and I use it just about every day. The controls are excellent. Those reviewers who complain that the lever stopped working must be using too much pressure to push it down. Because the lever is electronic and can be raised with the touch of a button, very little pressure is required to push it down. For the price, this toaster can't be beat. It makes perfect toast and toasted bagels at the desired setting and it is simple to clean.",Who Knew???,"I never knew what a challenge it would be to find a toaster that will toast on both sides evenly. This is my 4th or 5th toaster in the past 30 days; started out with of the most expensive toasters thinking at that price it has to toast perfectly; WRONG. Not only did it not toast on both sides but the bread would get stuck when it popped up. On to the hunt for the best toaster and reading dozens and dozens of reviews. Who knew this was more work than purchasing a new car!!! All I want is my toast to toast evenly on both sides - it that so hard to do???? Think about it - it's a TOASTER; isn't that the whole idea of a toaster? Put bread in, little-heated elements inside the toaster light up and cook the toast for a short time and then pop up. So why do some toaster toast one side OK and the other side is toasted randomly (maybe the top OR bottom or just the side). Hmmm, makes me wonder what's going on in their quality control :-). Anyway, I found the perfect toaster and this is it!! Great price, toasts evenly on BOTH sides just the way a toaster should. Don't hesitate if you're looking for a toaster to do a good job; don't let the fact that because this toaster is relatively inexpensive it's not a good toaster because it is - it's the BEST toaster. I've used it now for over a month and I continue to be impressed. English muffins have never been so well and evenly toasted. Can't say enough about how well this toaster does the job!!!!",Good Product.,"if you just need an ordinary toaster this one is great, love it. Toasts English muffins to a tee. If you want bells and whistles then buy bells and whistles."
B00N8XFFDI,B00N8XFFDI,https://m.media-amazon.com/images/I/61cTJyc+3IL._SL500_.jpg,https://m.media-amazon.com/images/I/41NXvHV8rDL._SL500_.jpg,https://m.media-amazon.com/images/I/41IisnWah8L._SL500_.jpg,https://m.media-amazon.com/images/I/41wBRVwEj0L._SL500_.jpg,https://m.media-amazon.com/images/I/41B+K4whhOL._SL500_.jpg,Home & Kitchen>Kitchen & Dining>Small Appliances>Ovens & Toasters>Toasters,Hamilton Beach,Home & Kitchen,Red,,"Sleek yet practical, for a contemporary kitchen. Hamilton Beach 2 Slice Toasters are popular not only for their expert toasting performance -- they also look great in your kitchen. Wider slots and smart buttons allow you to uniformly toast and warm bagels, English muffins and other breads and advanced toasting technology ensures consistent results with each use. For convenient toasting, these popular 2 Slice Toasters come equipped with toast boost and automatic shutoff; the slide-out crumb tray makes cleanup a snap.","Perfect for your favorite thick-cut bread or bagel: Extra-wide slots in this 2 slice toaster fit your favorite thick-cut bread, bagels, or anything else you want to toast. | The perfect toast every time: Make your toast exactly the way you like it with the convenient toast shade selector. | Auto shutoff: The auto shutoff feature and cancel button adds peace of mind to your busy mornings. Multitask without worrying about leaving breads or bagels cooking in the toaster. | Keep cords under wraps: Convenient cord storage keeps your toaster plug up and out of the way, making for safe and easy clean up and a clear counter. | Toast boosting technology: Lifts your toasted breads and bagels high when they're ready so you can easily retrieve them. | Material type: Nonstick",7.10E+00,11.2,2.689639596,6.3,toasters,https://m.media-amazon.com/images/I/41E-bGjLZ8L.jpg,Hamilton Beach,https://m.media-amazon.com/images/I/41E-bGjLZ8L._SL160_.jpg,B084J5TGYH,Kitchen,TOASTER,,Hamilton Beach,2-Slice,https://m.media-amazon.com/images/I/41E-bGjLZ8L._SS125_.jpg,Toasters,"Hamilton Beach Extra-Wide Slot Toaster with Shade Selector, Auto-Shutoff, Cancel Button and Toast Boost, 2-Slice, Red",1,4.5,1875,,B00N8XFFDI,22028,153282,,,,,,"Love This 2-Slice Pop-Up Toaster – Lightweight, Fast, Efficient, Easy Operation, With Uniform Browning on All Sides","For years and years, we had used our toaster oven to toast bread and muffins, and although our toaster oven is sufficient for baking and broiling, it really does not make ‘toast’. Although the bread would warm, it did not brown at all, until suddenly the bread would blacken and burn within seconds. Unfortunately, since the glass window in the toaster oven does not reach the bottom, we were never sure when the bread would start burning until we smelled it. Therefore we had two options, either eat warmed, untoasted bread, or take the chance and with any luck the bread would turn out very dark brown (not quite black), but unfortunately it usually would burn. Since we have enough kitchen appliances crowding our kitchen counter, I wanted a small 2- slice pop-up toaster, and without any extra ‘bells and whistles’. General Description: This Hamilton 2-slice pop-up toaster is perfect. It’s a lightweight compact toaster and it only measures 11” x 6”, with a 7 ¼” height, therefore it takes up very little space. In addition, since this toaster weighs less than 2 lbs. (1 lb. and 14 oz.), it’s not heavy, and I can easily put it away in a cabinet. It has a 30” electrical cord with a 2-prong plug. The color is a high gloss bright cherry red on the front and back, with a chrome finish on the top and sides. The spring loaded toaster slots are 5 ¼” long, x 1 ¼ “wide (to accommodate the thickness), and with a depth to fit and toast a 4” slice of bread, muffin, a sliced bagel or a sliced roll. This pop-up toaster has the cord storage area on the end and the cord remains coiled up securely and out of the way. The other end has the controls, which consists of a lever that is so easy to operate that I can use my pinky finger to push it down. A dial with a range of 1 – 7 controls the browning level, and there are segments between each number for a very precise toasting crunch and color. In addition there is a ‘cancel’ press button, to stop the toasting cycle and pop the slice up to the top. On the bottom is an attached crumb catcher tray that slides to the side for easy emptying and cleaning. Performance: There are 7 main settings for toast color and crunch, with the lightest at the number #1 and the toasting gets progressively darker and crispier as the dial adjustment moves to #7. I prefer the #4 toasting level for a light brown color and a mild crunch. This takes approximately 1 ½ - 2 minutes in the toaster, and the chrome sides remain comfortable to the touch. My toast cooks evenly in both slots and both sides of each slice have the identical crunch and color. We are very pleased with this Hamilton 2-slice pop-up toaster. It’s lightweight, fast and efficient, and it browns both sides of the bread evenly. We use it for bread, sliced bagels, hamburger buns, and English muffins, it is exactly what we needed.",Changed review to 5 star,"I originally bought this toaster Dec 2017. It only worked for a month and stopped so I wrote a bad review. It turned out to be owner error. When I originally purchased this toaster, I researched toasters and saw so many bad reviews at all price points. So I was not surprised it stopped working. Now it is June 2020 and this fifteen dollar toaster is still working great. I just ordered the same toaster again .",Great lightweight toaster from Hamilton Beach!,"I had an old toaster that has lasted a very long time until a few weeks ago. I bought this one because it is a Hamilton Beach and it has cool walls. I was always burning myself on my old one. I have tested this toaster on bagels and it toasts just fine. I like it on the 4 setting which is right in the middle. It keeps the bagel crisp but not burnt. I put my hands directly on the sides while and immediately after it was done and there is no heat coming through. Excellent! Besides the brand name and the cool walls, I also love that it is lightweight and has a place in the back to wrap the cord for storage. I keep my toaster on a shelf in my kitchen so the cord wrap keeps it neater. I have had no problems with this toaster and my only complaint would be that if I lived in Canada the warranty would be 5 years but in the USA it is only 1 year. What is up with that?","Toasts, and fast","Pros: Toasting works great. I read some reviews complaining about over-toasting - I don't have this problem. On setting 3 (out of 6) it's a bit under-toasted to my taste, and 4 is perfect. And, it works surprisingly fast! I hated so much staring at old toaster for long minutes, begging to pop already as life were mercilessly slipping away. Cons: The lever feels kind of flimsy and I am afraid to break it, especially since you need to push it a bit hard to lock it down. This is my main concern about durability. Also, the top panel does get very hot (the side panels do not), so be careful. Other notes: 1. I let run empty a couple of times before using it with bread, to let out some weird smell that it had in the beginning. It went away quickly. 2. Color, in case you care: It's brighter than shown in the product images. It's as if they were taken in a dimly lit setting. The actual color is fiery red with a slight lean towards cherry, or something like that. Overall I'm happy, and it seems to be worth its price. *** Update: After using this for a while, I'm updating from 4 to 5 stars. It's really great.",Quality toaster for price,"This toaster is so affordable that even if it malfunctions eventually it is no big deal. I've bought much more expensive toasters and frequently stopped working and I had to take the time to call the company, request a replacement, and wait for a week or so to receive a new toaster. I noticed this toaster had a longer warranty than my kitchen aid toaster which only had a year warranty! It says not to toast pop tarts in this toaster. That probably voids warranty if they found lots of pop tart jelly in your toaster. My husband thought that was so strange you couldn't put pop tarts in the toaster but oh well..we really don't eat them often at all. Before my first use of this toaster, I depressed the handle and did a toast without toast to burn off any chemicals or oils that remained from manufacturing. After that, it's worked marvelously. Will update if I have any problems!"
B07PZY11WN,B07PZY11WN,https://images-na.ssl-images-amazon.com/images/I/41oVtWN50mL.jpg,https://images-na.ssl-images-amazon.com/images/I/51PuX+89VcL.jpg,https://images-na.ssl-images-amazon.com/images/I/61uY2YjhmcL.jpg,https://images-na.ssl-images-amazon.com/images/I/515wtJhySjL.jpg,https://images-na.ssl-images-amazon.com/images/I/51xWUg-QhGL.jpg,Home & Kitchen>Kitchen & Dining>Small Appliances>Ovens & Toasters>Toasters,DASH,Home & Kitchen,Aqua,,"Imagine perfect toast, every time. With 7 Browning levels, The DASH clear view toaster takes the guesswork out of toasting. Don't take our word for it - see with your own eyes via the glass window. The toaster features one-touch buttons for defrosting, bagels and re-heating as well as an auto-shut off function for safety. With an extra long slot, you can toast a wide variety of breads and baked goods. Unprocessed your food with the recipe book that is included with purchase, and gain access to our database of thousands of recipes for free. Cord length - 42","MORE THAN TOAST: Defrost, Reheat, and Bagel one-touch buttons allow you to diversify your breakfast Extra wide slot makes toasting bagels, specialty breads, waffles, and other baked goods a snap. | SEE THROUGH WINDOW: 7 browning levels and the clear view window allow for that perfect toast with every use; plus, the auto-shut off feature prevents overheating. | QUICK + EASY: The crumb tray and glass window slide out for quick and easy clean up. The outer surfaces all wipe-clean. | PERFECT GIFT: The perfect wedding or new home gift Its small size takes up little counter space, and its sleek design and trendy color options will match any kitchen décor (add to your registry now!). | WARRANTY: Backed by a 1-year manufacturer warranty, the Dash Clear View Toaster includes recipe book and recipe database access (all non-electric parts are easily wiped clean). | U.S. BASED SUPPORT: Designed in NYC, with U.S. based Customer Support on every product.",7.80E+00,6.6,,15.7,toasters,https://m.media-amazon.com/images/I/41oVtWN50mL.jpg,StoreBound,https://m.media-amazon.com/images/I/41oVtWN50mL._SL160_.jpg,B016B9ZJY0,Kitchen,TOASTER,,StoreBound,2 Slice,https://m.media-amazon.com/images/I/41oVtWN50mL._SS125_.jpg,Toasters,"Dash Clear View Toaster: Extra Wide Slot Toaster with See Through Window - Defrost, Reheat + Auto Shut Off Feature for Bagels, Specialty Breads & other Baked Goods - Aqua",1,4.5,1659,,B07PZY11WN,22028,153289,,,,,,"Unexpectedly, I LOVE This Toaster!","Let’s be real, we are talking about a toaster, a TOASTER! Why should anyone want to write a review of the most used and easiest to forget ancillary appliance you own? Because the Dash Clear View Toaster is that awesome! The short of it; don’t waste your time looking for anything else. This toaster can handle anything you throw at it with golden brown perfection, quickly. The Dash Clear View Toaster is the best bang for your buck, hands down! The long of it. We are a “somewhat” healthy eating family. We run the gambit when it comes to bread choices. Hardly ever white, mostly wheat for the kids, and tapioca and/or rice bread for the adults. Not all breads toast to perfection at the same rate. Each one of these breads has a very specific heat tolerance that can make for difficult toasting times. And that’s where the window really comes in handy. With the Dash Clear View Toaster you can sit back and enjoy the toasting experience all while watching the progress through its’ front window. Gone are the days of premature toast ejection just to check on the “doneness” of a specific bread only to have to reinsert the payload back into the heated bay. Visible perfection each and every time. With the white or Tapioca bread, which toast rather quickly, a quick turn to 4 gives us the perfect amount of crunch. The wheat bread takes slightly longer, about a 5 to a 5.5 max. And then there is the ALWAYS FROZEN rice bread. This beast of a bread (Food for Life brand) is twice toasted. Once as a 7 with “defrost” selected and a second plunge at a 7 without the “defrost” selected. AMAZING! The controls are easy to understand, clearly marked and simple to operate. Plug it in, place the toast in the slot provided, push down the plunger and away you go. It takes a matter of a use or two to figure out the proper settings to your liking. The “defrost” feature just doubles the time on the dial. The “bagel” feature only toasts on one side. With some sandwich breads like rye / pumpernickel etc. that have a tendency to toast really well and tear-up the roof of your mouth I like to use the bagel setting. Put the toasted side to the inside (meat side) and the soft untoasted side to the outside, you get the crunch without tearing up the roof of your mouth. AWESOMNESS! I have yet to use the “re-heat” feature … so you are on your own with that one. Sorry Charlie. As far as the toast rocketing from the toaster with the velocity of an unladen swallow, African or Eurpean – doesn’t matter, I have found that to be inconsequential. Does it pop up and sometime flop out on its own? Yes, rarely. But that has happened with my old toaster as well (a re-gifted 2 slice Panasonic that we got as a wedding gift 22 years ago). So really I kind of like the nostalgia of it when it does happen. BONUS! Let’s just hope that I get 22 years out of this amazing beast. So in conclusion, I just wrote an essay on a toaster. What the hell am I thinking?! Yes, it is that great. Click the “Add to Cart” button and get the Dash Clear View Toaster. You will not regret yourself for doing so, unlike your college spring break weekend. Love you son!","Well designed, great looking...and it toasts!","Just short of our 25th anniversary our old toaster (guess when we got it) bit the dust. There is limited counter space in the kitchen of our Victorian home and we thought the wall hugging design of this toaster was a good idea. The design has a sort of 1950s vibe to it - sort of a Wurlitzer juke box or maybe a little hint of Flash Gordon going on. We really like it. The PROs: *Can't say enough good about being able to see how your toast is doing - it's a whole dimension of usefulness that other toasters don't even address. *All controls are up front and highly visible - no more having to crane your neck down to the side of your toaster to see which button is which - and then having to guess anyway because the printing has probably worn off...or having to wonder which way you have to turn the dial to get your toast lighter or darker. *Really nice looking and a bit different. We like things that are a bit different, like each other, or our kids, or our dogs. The CONs: *I thought about dinging it a star because, as others have reported, the ejection spring is a bit - how shall we put it? - enthusiastic. Especially with a smaller or lighter item it will occasionally launch your breakfast right out of the slot. But on second thought we find this amusing rather than annoying - and far preferable to having to fish your toast out of the slot because your spring has lost its mojo. So we actually consider this a little plus. In case you're wondering, when you select bagel it toasts the side that's facing the window so you can still see how your toast is doing, so the designers were on the ball there. Right now ours tends to brown more quickly toward the top than the bottom but other reviewers have noted that this somehow evens out over time so we'll give it the benefit of the doubt and hope this will happen with ours. It's not drastically uneven but it is noticeable right now. My wife was a bit hesitant to spend more than about twenty bucks for a toaster but we're both glad we did as this thing is designed so very well, looks absolutely great, and is something that is just a bit different from the standard polished cube, adding a touch of style to the kitchen counter. And being able to see how our toast is doing means we may well never burn a breakfast again. Outstanding!",Update: make sure the crumb tray is in place!,"UPDATE: We thought it was broken because it wouldn't depress. turns out the crumb tray wasn't in place and this is some sort of safety mechanism. LURVE THIS TOASTER! One of the best features is that the buttons for the different settings (defrost, toast, bagel) don't have printing on them which can rub off over time effectively rendering them useless (I'm looking at you Oster). And it provides a surprising amount of entertainment for my kids and I what with the window to my toast's progress and the occasional flying toast which has so far landed quite helpfully on top of the toaster slot, actually making it very easy to retrieve our toast. Another unhappy mention for the Oster - it wouldn't pop the toast after maybe six months and I caught my kids fishing their toast out with a fork. Thankfully they have the sense to unplug it, but still. I have yet to comment on durability. My toaster is used, then put away, so it does need to be sturdy. I'll be happy if it outlasts my stupid Oster which didn't see it's first birthday.",Early in the morning toast looks like a sunrise in its window and toast in the ...,"This toaster is worth the price just for the entertainment value. Early in the morning toast looks like a sunrise in its window and toast in the evening is like watching the sunset by the orange glow in the see thru window. Some toast pops out and lands on top ready to pick up, sometimes the toast is found sitting on the counter next to the toaster when it has popped up, this will all depend on the weight of the bread (12 grain VS Wonder white)Seriously it does toast bread evenly and works good. I would try to toast breadsticks but I am afraid I might get hit by the flying bread sticks as they launch. Would buy again and have recommended to friends.",Home Run!,"This is a very interesting toaster. There are two rods (about 1/4inch diameter by 11 inches long) at the bottom that get red hot and radiate upwards to toast. This is one reason I bought this toaster; I’m hoping that these rods will last longer and give better service than the old skinny wires that seem to go bad in spots in no time at all. We will see about this over time. But, the main reasons I give five stars to this toaster is 1) great look, 2) one long toaster slot, 3)view window, 4)unique heating elements. I can now toast odd things like hot dog and hamburger buns; or large bagels or even large pieces of bread from a loaf! And can decide to toast on one side or both! The only negative thing I can say is; I wish the crumb tray would slide out from the same side as the lever to start toasting. Other than that one minor want, this toaster is a home run! Worth the 50bucks! And would recommend this item to anyone interested. Thanks, Reamo"
